platform,text_content,date,keyword_used,category,source_url,country_context,location_geographic,sentiment_score,top_20_mapping
Google Search,"pet monkey in the united states, most states restrict monkey ownership, whether via licensing requirements or outright bans, but, as of 2016, 13 states allow it.",2026-02-27,pet monkey,Primate,https://en.wikipedia.org/wiki/Pet_monkey,United States,National (US),0.1055,
Google Search,"the challenges of keeping a capuchin monkey as a pet currently, you can legally own a capuchin monkey in states like north carolina, florida, nevada, ohio, texas, mississippi, tennessee, alabama, ...",2026-02-27,pet monkey,Primate,https://www.thesprucepets.com/pet-capuchin-monkeys-1239552,United States,National (US),0.4939,
Google Search,"legality of owning a monkey in the u.s. and canada [oc] at least in the us, it's legal to own one if you have the correct usda liscences. it's for zoo's and animal rescues.",2026-02-27,pet monkey,Primate,https://www.reddit.com/r/dataisbeautiful/comments/kg0b4o/legality_of_owning_a_monkey_in_the_us_and_canada/,United States,National (US),0.4215,
Google Search,primate pet ownership fuels a brutal industry. this bill ... california is among the states with total bans on pet primate ownership. others have partial bans. but in some states it remains legal for ...,2026-02-27,pet monkey,Primate,https://www.npr.org/2025/07/26/nx-s1-5463589/captive-primate-safety-act-exotic-pet-trade-illegal,United States,National (US),-0.2023,
Google Search,"how to buy a monkey (& what to consider before you do) while you may be able to buy a monkey in some states, it's illegal in most states unless you have a permit. monkeys, cute as they are, can be very high- ...",2026-02-27,pet monkey,Primate,https://www.wikihow.com/Buy-a-Monkey,United States,National (US),-0.1531,"Q1_Sentiment, Q4_Legal_Risk"
Google Search,"are there any good reasons not to have a pet monkey ... yes, there are plenty of “non legal” reasons not to have a pet monkey or ape. pros: when they're babies, they cling to you and are simply adorable.",2026-02-27,pet monkey,Primate,https://www.quora.com/Are-there-any-good-reasons-not-to-have-a-pet-monkey-not-talking-about-the-legal-ones-What-are-some-of-the-pros-and-cons-of-having-one,United States,National (US),0.8316,
Google Search,"keeping primates as pets | rspca primates are not suitable house pets. they need space, companions and mental stimulation, not what you find in someone's living room.",2026-02-27,pet monkey,Primate,https://www.rspca.org.uk/adviceandwelfare/pets/other/primates,United States,National (US),0.0,
Google Search,10 compelling reasons to avoid a pet monkey 1. legal complexities: · 2. safety concerns: · 3. training challenges: · 4. incompatibility with household: · 5. high maintenance and specialized ...,2026-02-27,pet monkey,Primate,https://www.jaguarrescue.foundation/en-us/News/ArticleID/44/10-Compelling-Reasons-to-Avoid-a-Pet-Monkey-A-Must-Read,United States,National (US),0.5106,
Google Search,"can monkeys make good pets? the legality of owning a monkey varies, depending on where you live. some states say absolutely not, whereas other states say it's ok in certain circumstances.",2026-02-27,pet monkey,Primate,https://www.petassure.com/maxscorner/can-monkeys-make-good-pets/,United States,National (US),0.7351,
Google Search,10 compelling reasons to avoid a pet monkey primate pet ownership is sometimes either completely prohibited or necessitates the purchase of expensive licences. the jrc supports a worldwide ...,2026-02-27,pet macaque,Primate,https://www.jaguarrescue.foundation/en-us/News/ArticleID/44/10-Compelling-Reasons-to-Avoid-a-Pet-Monkey-A-Must-Read,United States,National (US),0.296,Q5_Safety_Risk
Google Search,do primates make good pets? many primates are endangered and it is illegal to keep them as pets or even in captivity. many primates are taken illegally from their families and habitats in ...,2026-02-27,pet macaque,Primate,https://primate.wisc.edu/primate-info-net/pin-factsheets/pin-factsheet-primates-as-pets/,United States,National (US),-0.1779,"Q1_Sentiment, Q4_Legal_Risk, Q5_Safety_Risk, Q6_Animal_Welfare"
Google Search,"is there any situation where you can ethically have a ... no, there is no ethical way to have a primate 'pet'. there are sanctuaries, but that is not having a pet, and you would have to work/volunteer there for a ...",2026-02-27,pet macaque,Primate,https://www.reddit.com/r/primatology/comments/iu163p/is_there_any_situation_where_you_can_ethically/,United States,National (US),-0.2146,
Google Search,"primate pet ownership fuels a brutal industry. this bill ... spider monkeys, like violeta, are now among the most-trafficked animals and are listed as endangered by the international union for conservation ...",2026-02-27,pet macaque,Primate,https://www.npr.org/2025/07/26/nx-s1-5463589/captive-primate-safety-act-exotic-pet-trade-illegal,United States,National (US),-0.3818,Q5_Safety_Risk
Google Search,"primates as pets several thousand monkeys and other non-human primates are believed to be in private ownership in the uk. the most commonly kept species, which include ...",2026-02-27,pet macaque,Primate,https://www.humaneworld.org/en/news/primates-pets,United States,National (US),0.0,
Google Search,the darwin saga: macaques as pets - worms & germs blog stress-associated health and behavioural problems are quite common in pet macaques. the lifespan of these monkeys also needs to be considered.,2026-02-27,pet macaque,Primate,https://www.wormsandgermsblog.com/2012/12/articles/animals/other-animals/the-darwin-saga-macaques-as-pets/,United States,National (US),-0.4019,
Google Search,"pet monkey in the united states, most states restrict monkey ownership, whether via licensing requirements or outright bans, but, as of 2016, 13 states allow it.",2026-02-27,pet macaque,Primate,https://en.wikipedia.org/wiki/Pet_monkey,United States,National (US),0.1055,
Google Search,"the facts about primates as 'pets' there are no federal laws in the united states that ban primate ownership or exotic animal ownership in general. as a result, responsibility for ...",2026-02-27,pet macaque,Primate,https://www.bornfreeusa.org/2011/08/09/the-facts-about-primates-as-pets/,United States,National (US),-0.4588,Q4_Legal_Risk
Google Search,"pet monkey care: challenges, costs, and considerations a well-cared-for monkey can generally live to be anywhere from 20 to 40 years old and will need your full commitment throughout their entire life.",2026-02-27,pet macaque,Primate,https://www.thesprucepets.com/problems-with-pet-monkeys-1237180,United States,National (US),0.7269,Q6_Animal_Welfare
Google Search,chimps as pets - why you not have ... chimpanzees should never be kept as pets. chimps are undomesticated wild animals and they do not make good pets. learn more on chimp haven.,2026-02-27,pet chimpanzee,Primate,https://chimphaven.org/education/chimp-as-pets/,United States,National (US),-0.3412,
Google Search,"should you keep a chimpanzee as a pet? adult chimps are much stronger than most humans, so an unruly chimp may easily harm—or even kill—its owner. chimpanzee behavior and temperament ...",2026-02-27,pet chimpanzee,Primate,https://www.thesprucepets.com/pet-chimpanzees-1238274,United States,National (US),0.6124,Q5_Safety_Risk
Google Search,"chimpanzee owners what's it like keeping a chimp as a pet ... with the chimps and toddles, they will never ever ever have the chimp close enough to be able to grab or hold the toddler but they do allow ...",2026-02-27,pet chimpanzee,Primate,https://www.reddit.com/r/AskReddit/comments/uumpv8/chimpanzee_owners_whats_it_like_keeping_a_chimp/,United States,National (US),0.4767,
Google Search,"chimpanzees as pets pet chimpanzees, like all captive chimpanzees, need the companionship of other chimps, extensive veterinary care by a qualified chimpanzee vet, a variety of ...",2026-02-27,pet chimpanzee,Primate,https://savethechimps.org/chimpanzees-as-pets/,United States,National (US),0.6908,Q6_Animal_Welfare
Google Search,"chimp crazy documentary highlights tragic ... chimp crazy, a four-part documentary that explores the complex world of chimpanzees in human care, will debut today on hbo.",2026-02-27,pet chimpanzee,Primate,https://www.aza.org/aza-news-releases/posts/chimp-crazy-documentary-highlights-tragic-consequences-of-exotic-pet-ownership,United States,National (US),-0.5574,Q6_Animal_Welfare
Google Search,chimpanzees as pets chimpanzees can and will bite. several former pet owners have suffered severe facial damage and have lost fingers and other appendages because of a chimpanzee ...,2026-02-27,pet chimpanzee,Primate,https://chimpsnw.org/resources/advocacy/chimpanzees-as-pets/,United States,National (US),-0.8834,Q5_Safety_Risk
Google Search,"captive primate safety act (federal) hbo launched a new docuseries, chimp crazy, which details the tragic consequences of keeping chimpanzees as “pets.” the four-part series highlights the stories ...",2026-02-27,pet chimpanzee,Primate,https://aldf.org/project/captive-primate-safety-act-federal/,United States,National (US),-0.2732,
Google Search,peta's influence on primate ownership and potential ban you see there was a woman who had owned a chimpanzee as a pet for ... ban ownership of pet chimpanzees. charlene sanouvong. 1 reaction.,2026-02-27,pet chimpanzee,Primate,https://www.facebook.com/groups/637767967589001/posts/1274409537258171/,United States,National (US),-0.802,
Google Search,"what is the cost of owning a pet chimpanzee in the united ... it is illegal to keep a chimpanzee as a pet, as they are a protected species. chimpanzees are very smart and highly dextrous- like people. good ...",2026-02-27,pet chimpanzee,Primate,https://www.quora.com/What-is-the-cost-of-owning-a-pet-chimpanzee-in-the-United-States,United States,National (US),0.868,"Q1_Sentiment, Q4_Legal_Risk"
Google Search,"wwf guide: why slow lorises aren't pets pygmy slow loris. nycticebus pygmaeus. a slow loris sits in a tree and looks directly at the camera with big,. © shutterstock.",2026-02-27,pet slow loris,Primate,https://www.worldwildlife.org/our-work/wildlife/wildlife-crime/responsible-pet-guide/assessed-exotic-species/pygmy-slow-loris/,United States,National (US),0.0,
Google Search,"the truth behind the slow loris pet trade if you come across a video or photo of a pet slow loris on the internet, while it may appear cute, the animal in the video is suffering and so is the entire ...",2026-02-27,pet slow loris,Primate,https://www.internationalanimalrescue.org/truth-behind-slow-loris-pet-trade,United States,National (US),0.296,Q6_Animal_Welfare
Google Search,"pet trade's “cute” and “adorable” label endangers the slow ... the slow loris includes all the species of the genus nycticebus, which range from northeast india to southeast asia, indonesia and the ...",2026-02-27,pet slow loris,Primate,https://news.mongabay.com/2016/08/pet-trades-cute-and-adorable-label-endangers-the-slow-loris/,United States,National (US),0.0,Q5_Safety_Risk
Google Search,conservation of slow lorises slow lorises are nocturnal strepsirrhine primates in the genus nycticebus that live in the rainforests of south and southeast asia.,2026-02-27,pet slow loris,Primate,https://en.wikipedia.org/wiki/Conservation_of_slow_lorises,United States,National (US),0.0,
Google Search,"are humans pushing the slow loris to extinction? ... slow lorises from being sold on the illegal pet market. customers find them irresistible, but these primates don't fare well as pets. before ...",2026-02-27,pet slow loris,Primate,https://www.nationalgeographic.com/magazine/article/explore-animals-illegal-pet-trade-slow-loris,United States,National (US),-0.4255,"Q1_Sentiment, Q4_Legal_Risk"
Google Search,"why not buy a slow loris being poisonous nocturnal wild animals with an unusual diet, slow lorises are completely unsuitable pets. if they survive the journey from the forest, ...",2026-02-27,pet slow loris,Primate,https://www.kukang.org/en/why-not-to-buy-a-slow-loris,United States,National (US),-0.5719,
Google Search,"wildlife trafficking in the age of social media primates are among the most ubiquitous species affected by illegal wildlife trade, with the slow loris being under extreme pressure due to their ...",2026-02-27,pet slow loris,Primate,https://www.currentconservation.org/wildlife-trafficking-in-the-age-of-social-media-the-story-of-the-slow-loris/,United States,National (US),-0.788,"Q1_Sentiment, Q4_Legal_Risk"
Google Search,saving the slow loris this adorableness has made the slow loris a darling of the illegal exotic pet trade. wildlife trafficking--along with hunting and habitat ...,2026-02-27,pet slow loris,Primate,https://www.nsf.gov/news/saving-slow-loris,United States,National (US),0.6514,"Q1_Sentiment, Q4_Legal_Risk"
Google Search,"slow loris summary. four of the five nycticebus (slow loris) species are listed by the iucn as vulnerable, and the javan slow loris (nycticebus javanicus) is listed as ...",2026-02-27,pet slow loris,Primate,https://wildlifeleaders.org/projects/class-projects/slow-loris,United States,National (US),-0.2263,
Google Search,"freeing poached wildlife 'safely' is a dangerous myth the moment a cage door is opened and an animal released is often seen as the ultimate good news. when a captive wild animal is freed, ...",2026-02-27,pet slow loris,Primate,https://theconversation.com/freeing-poached-wildlife-safely-is-a-dangerous-myth-new-study-275586,United States,National (US),0.8316,"Q1_Sentiment, Q5_Safety_Risk"
Google Search,"[ama request] anyone who owns a pet tiger or personally ... owning a tiger is really, really wrong. they are borderline sapient. they are absolutely aware of themselves, they are aware of you as a ...",2026-02-27,pet tiger,Big Cat,https://www.reddit.com/r/IAmA/comments/85ba9z/ama_request_anyone_who_owns_a_pet_tiger_or/,United States,National (US),-0.5678,
Google Search,"state laws exotic cats no person may possess any dangerous animal, defined to include a lion, tiger ... no personal possession permits for the purpose of pet ownership will be issued.",2026-02-27,pet tiger,Big Cat,https://bigcatrescue.org/conservation-news/state-laws-exotic-cats,United States,National (US),-0.7579,"Q1_Sentiment, Q4_Legal_Risk, Q5_Safety_Risk"
Google Search,"are more tigers in backyards than in the wild? ... statistics show that between 5,000 and 7,000 tigers live in private hands in the united states, compared to only about 5,574 in the wild ...",2026-02-27,pet tiger,Big Cat,https://www.lionstigersandbears.org/are-more-tigers-in-backyards-than-in-the-wild-the-shocking-truth-about-exotic-animals-in-the-usa/,United States,National (US),0.4215,
Google Search,"should you keep a tiger as a pet? ownership of tigers poses significant risks and ethical concerns, making accredited zoos or rescue preserves a better place for these animals.",2026-02-27,pet tiger,Big Cat,https://www.thesprucepets.com/pet-tigers-1238150,United States,National (US),0.8481,
Google Search,"big-cat owners must register by june 18 the big cat public safety act makes it illegal to privately possess or breed big cats. the act was signed into law december 20, 2022, to end ...",2026-02-27,pet tiger,Big Cat,https://www.fws.gov/press-release/2023-04/big-cat-owners-must-register-june-18,United States,National (US),-0.2023,"Q1_Sentiment, Q4_Legal_Risk"
Google Search,"is it possible to own a tiger as a pet? ... short answer – in my beloved country, the private ownership of endangered cats, including tigers, is forbidden unless the person has a ...",2026-02-27,pet tiger,Big Cat,https://www.quora.com/Is-it-possible-to-own-a-tiger-as-a-pet-What-are-the-requirements-and-legalities-involved-in-owning-a-tiger,United States,National (US),0.128,"Q1_Sentiment, Q5_Safety_Risk"
Google Search,private tiger ownership in u.s. they agree that private tiger ownership threatens public safety and undermines conservation efforts; in short—that tigers belong in the wild.,2026-02-27,pet tiger,Big Cat,https://pulitzercenter.org/stories/private-tiger-ownership-us,United States,National (US),0.0772,
Google Search,"born free exotic animals as 'pets' https://www.peta. org ... americans can get permission to keep tigers relatively easily by giving a name, address and a $40 fee. this allows owners to legally keep a big ...",2026-02-27,pet tiger,Big Cat,https://www.facebook.com/animalmattersinternational/posts/approximately-6000-tigers-are-currently-being-kept-as-pets-in-the-united-states-/1034342775404516/,United States,National (US),0.8176,
Google Search,"can you own a lion in the united states? the big cat public safety act, signed into law in december 2022, makes it illegal to privately possess or breed big cats, including lions, ...",2026-02-27,pet lion,Big Cat,https://www.reddit.com/r/CasualConversation/comments/1m0wuag/can_you_own_a_lion_in_the_united_states/,United States,National (US),0.25,"Q1_Sentiment, Q4_Legal_Risk"
Google Search,"where to live if you want a pet lion five states don't allow private ownership of lions under any circumstances, and the rest allow you to own a lion within certain legal guidelines ...",2026-02-27,pet lion,Big Cat,https://lifehacker.com/where-to-live-if-you-want-a-pet-lion-1848309048,United States,National (US),0.4826,Q1_Sentiment
Google Search,"'people buy a lion and can't handle it': inside the farms ... while lion ownership requires a licence, breeding does not – anyone who legally owns lions can also breed them. cubs don't need to be registered ...",2026-02-27,pet lion,Big Cat,https://www.theguardian.com/environment/2025/may/28/thailand-lion-exotic-pet-trade-instagram-tiktok-aoe,United States,National (US),0.1027,
Google Search,"is it legal to own a lion in america? if not, what ... all wildlife kept as personal pets require a state issued permit . lions are classified as class 1 and it is virtually impossible to obtain such ...",2026-02-27,pet lion,Big Cat,https://www.quora.com/Is-it-legal-to-own-a-lion-in-America-If-not-what-is-the-closest-legal-alternative-and-how-much-does-it-cost,United States,National (US),0.128,Q4_Legal_Risk
Google Search,"petting cafes to homes: thailand's soaring captive lion ... lion ownership is rising in thailand, prompting concerns over welfare, regulation, and illegal wildlife trade.",2026-02-27,pet lion,Big Cat,https://www.aljazeera.com/gallery/2025/8/4/petting-cafes-to-homes-thailands-soaring-captive-lion-population,United States,National (US),-0.5574,"Q1_Sentiment, Q4_Legal_Risk"
Google Search,"'absolute madness': thailand's pet lion problem thailand's captive lion population has exploded in recent years, with nearly 500 registered in zoos, breeding farms, petting cafes and homes.",2026-02-27,pet lion,Big Cat,https://www.barrons.com/news/absolute-madness-thailand-s-pet-lion-problem-5940113a?gaa_at=eafs&gaa_n=AWEtsqe6RaSoLaBQ93mp4xQjDHYdoSFi8wkMZCcKfM7jCDNGCHMl8qNBfoLH&gaa_ts=69a1cce3&gaa_sig=fcG1Bm_YzWmSPOGQctMVzXsRe_c4kQprCCzZBOSAn2O4FLGYXs-T3WXj5rYmBzc4Lzom2tblCHMGfMLCQuuavA%3D%3D,United States,National (US),-0.6808,
Google Search,"so. hypothetically speaking, if i wanted to own a lion ... it is up to local ordinances. if your local government (city, township, or county) doesn't have any restrictions then technically you could own a lion.",2026-02-27,pet lion,Big Cat,https://www.reddit.com/r/wisconsin/comments/vvlwv5/so_hypothetically_speaking_if_i_wanted_to_own_a/,United States,National (US),0.0,Q1_Sentiment
Google Search,"apparently previous owner many years ago kept a pet lion ... in the 1950s, charles hipp - an oil businessman from texas got a lion as a family pet. it never caused any problems, and even gave piggyback ...",2026-02-27,pet lion,Big Cat,https://www.facebook.com/groups/7936534691/posts/10158459747834692/,United States,National (US),0.3089,
Google Search,"what you need to know about adding a serval to your ... servals around the age of two develop personality and behavioral changes, often negatively tolerated by under-educated and under-equipped owners ...",2026-02-27,pet serval,Big Cat,https://www.savannahgans.com/blog-1/servalpet,United States,National (US),0.0,
Google Search,"do serval cats make good house pets? although servals (a wild cat) are not included in the provincial controlled alien species legislation, that doesn't mean they should be kept as pets.",2026-02-27,pet serval,Big Cat,https://spca.bc.ca/faqs/do-serval-cats-make-good-house-pets/,United States,National (US),0.4404,
Google Search,"everything about ownership — serval pet breeders a african serval should be bred from two parents that don't spray, are kind with strangers, good with children and have no issues with anxiety.",2026-02-27,pet serval,Big Cat,https://www.servalcatforsale.com/everything-about-ownership,United States,National (US),-0.4168,
Google Search,what's it like to own a serval cat in like a house? they are dangerous wild animals and should not be staying a home with humans. it's cruel for the cat and unsafe for you.,2026-02-27,pet serval,Big Cat,https://www.reddit.com/r/serval/comments/16wrt6m/whats_it_like_to_own_a_serval_cat_in_like_a_house/,United States,National (US),-0.4404,"Q1_Sentiment, Q5_Safety_Risk"
Google Search,"servals: why they don't make good pets legal restrictions: in many places, it's illegal to own a serval as a pet due to their potential danger to humans and the exotic pet trade regulations.",2026-02-27,pet serval,Big Cat,https://carolinatigerrescue.org/education-blog/servals-why-they-dont-make-good-pets/,United States,National (US),-0.8362,"Q1_Sentiment, Q4_Legal_Risk, Q5_Safety_Risk"
Google Search,"are serval cats good pets? in all other states, serval ownership is illegal. it is either legal or illegal, they belong to wild. so, it would be better if we let them be ...",2026-02-27,pet serval,Big Cat,https://www.facebook.com/groups/wildcatsanctuary/posts/2359740881054813/,United States,National (US),-0.2263,"Q1_Sentiment, Q4_Legal_Risk"
Google Search,"servals are not pets big cat rescue it is illegal to own a serval in california without a special permit. los angeles animal services is working to determine if the cat has an owner. june 21, 2019 ...",2026-02-27,pet serval,Big Cat,https://bigcatrescue.org/conservation-news/servals-not-pets,United States,National (US),-0.3732,"Q1_Sentiment, Q4_Legal_Risk"
Google Search,"what are the pros and cons of owning a serval as a pet? ... the serval is a small, endangered wild cat. servals are no more suitable (ie, not at all) as pets than bobcats or lynxes would be. they are wild animals.",2026-02-27,pet serval,Big Cat,https://www.quora.com/What-are-the-pros-and-cons-of-owning-a-serval-as-a-pet-Are-there-any-other-big-cats-that-can-be-owned-as-pets-in-the-United-States-or-is-it-only-lions-and-tigers,United States,National (US),-0.296,Q5_Safety_Risk
Google Search,"caracals as pets: understanding behavior, diet, and risks think you're ready to keep a caracal as a pet? here are the personal, legal & financial responsibilities that make caring for a caracal so tough.",2026-02-27,pet caracal,Big Cat,https://www.petplace.com/article/cats/pet-care/caracals-as-pets,United States,National (US),0.4782,
Google Search,"cmv: caracals should never be kept as pets. every video i see of a caracal, that thing is angry. they don't seem to like their humans, and the cat always has something loud and nasty to say about it.",2026-02-27,pet caracal,Big Cat,https://www.reddit.com/r/changemyview/comments/t1j6m1/cmv_caracals_should_never_be_kept_as_pets/,United States,National (US),-0.8406,
Google Search,"pet caracal legal states 2026 costs of caracal ownership. the average caracal purchase can start at $1,500 ... the states that allow a pet caracal to be owned are: arizona; arkansas ...",2026-02-27,pet caracal,Big Cat,https://worldpopulationreview.com/state-rankings/pet-caracal-legal-states,United States,National (US),0.34,
Google Search,"do caracals make good pets? wildlife experts strongly warn against keeping caracals as pets, even if it is legal to do so in your state. the caracal has long legs, a short, ...",2026-02-27,pet caracal,Big Cat,https://cats.com/do-caracals-make-good-pets,United States,National (US),0.6249,
Google Search,"state laws exotic cats permits are required for public exhibition, sale or personal possession of class ii wildlife which include bobcats, servals and caracals. ... no personal ...",2026-02-27,pet caracal,Big Cat,https://bigcatrescue.org/conservation-news/state-laws-exotic-cats,United States,National (US),-0.296,Q4_Legal_Risk
Google Search,who here owns a caracal ? i have been considering ... who here owns a caracal ? i have been considering getting one but i don't know anyone that has one personally and i have questions about owning ...,2026-02-27,pet caracal,Big Cat,https://www.facebook.com/groups/2743149249047995/posts/7297324503630424/,United States,National (US),0.0,
Google Search,"caracal as a pet. wtf? not pets, but some are raised to be sold as pets. so this isn't as bad as those that try to keep cougars as pets or any of the big cats. they ...",2026-02-27,pet caracal,Big Cat,https://boards.straightdope.com/t/caracal-as-a-pet-wtf/990305,United States,National (US),0.3346,
Google Search,"how dangerous are caracal cats? risks to humans, ... regardless of legality, wildlife experts strongly caution people against keeping caracals as pets. the high level of risk to both humans and ...",2026-02-27,pet caracal,Big Cat,https://a-z-animals.com/blog/how-dangerous-are-caracal-cats-risks-to-humans-dogs-and-more/,United States,National (US),-0.6369,"Q1_Sentiment, Q5_Safety_Risk"
Google Search,"can you domesticate a caracal? not that i'd advise having one as a pet - they are not domesticated, only tame and they can do you serious harm. they are a species of wild cat, ...",2026-02-27,pet caracal,Big Cat,https://www.quora.com/Can-you-domesticate-a-caracal,United States,National (US),-0.5859,
