platform,text_content,date,keyword_used,category,source_url,country_context,location_geographic,sentiment_score,top_20_mapping
Google Search,"state laws exotic cats under § 26-40a, no person shall possess a potentially dangerous animal, which includes wildlife such as the lion, leopard, cheetah ... no personal possession ...",2026-02-27,pet cheetah,Big Cat,https://bigcatrescue.org/conservation-news/state-laws-exotic-cats,United States,National (US),-0.7579,"Q1_Sentiment, Q4_Legal_Risk, Q5_Safety_Risk"
Google Search,can i get a pet cheetah? and does anyone here own ... no. there are no domesticated cheetahs. you cannot 'domesticate' a cheetah because it takes decades of breeding to domesticate any type of ...,2026-02-27,pet cheetah,Big Cat,https://www.quora.com/Can-I-get-a-pet-cheetah-And-does-anyone-here-own-a-cheetah,United States,National (US),-0.296,
Google Search,"cheetah pet risk and care assessment this assessment explains the high risk of a cheetah and outlines important care, health, and habitat considerations for pet owners.",2026-02-27,pet cheetah,Big Cat,https://www.worldwildlife.org/our-work/wildlife/wildlife-crime/responsible-pet-guide/assessed-exotic-species/cheetah/,United States,National (US),0.6124,Q6_Animal_Welfare
Google Search,"about cheetahs though cheetah ownership and exotic pet ownership has been outlawed in many countries, there is still a high demand for cheetahs as pets. cubs are illegally ...",2026-02-27,pet cheetah,Big Cat,https://cheetah.org/learn/about-cheetahs/,United States,National (US),-0.128,"Q1_Sentiment, Q4_Legal_Risk"
Google Search,"is the reason why cheetahs can't be domesticated simply ... do you think our world could ever accommodate a animal like a cheetah for it to be ethical as a pet? ... this is a very trustworthy exotic owner"".",2026-02-27,pet cheetah,Big Cat,https://www.reddit.com/r/Animals/comments/1mrc65b/is_the_reason_why_cheetahs_cant_be_domesticated/,United States,National (US),0.8655,
Google Search,"state laws: private possession of exotic animals summary of law: a person shall not own or possess a large carnivore, including but not limited to: lions, leopards, jaguars, tigers, cougars, panthers, cheetahs ...",2026-02-27,pet cheetah,Big Cat,https://www.bornfreeusa.org/campaigns/animals-in-captivity/summary-state-laws-exotic-animals/,United States,National (US),0.2498,Q4_Legal_Risk
Google Search,"due to the skittish nature of cheetahs living in captivity, dogs ... due to the skittish nature of cheetahs living in captivity, dogs will often be partnered and raised with them so they can be happier and more social.",2026-02-27,pet cheetah,Big Cat,https://www.reddit.com/r/Damnthatsinteresting/comments/x2year/due_to_the_skittish_nature_of_cheetahs_living_in/,United States,National (US),0.5267,Q6_Animal_Welfare
Google Search,"cheetahs are being bought by the ultra-rich illegally hundreds of cheetahs are smuggled from the horn of africa to gulf countries each year, where they're sold to the ultra-rich as pets.",2026-02-27,pet cheetah,Big Cat,https://www.cnn.com/2019/08/28/africa/somaliland-cheetahs-gulf-intl,United States,National (US),-0.3612,"Q1_Sentiment, Q4_Legal_Risk"
Google Search,"cheetahs are actually good pets, but are unpopular due to ... you cannot move the cheetah off your property, because your permit only covers where you live. you certainly cannot take it to a hotel. the zoo ...",2026-02-27,pet cheetah,Big Cat,https://www.reddit.com/r/IsItBullshit/comments/dkhmjz/isitbullshit_cheetahs_are_actually_good_pets_but/,United States,National (US),0.6187,Q4_Legal_Risk
Google Search,"pet python safety | snake care tips for pet owners the most popular species among pet owners, the ball python, rarely grows longer than five feet, so it can't possibly kill or eat a human. green ...",2026-02-27,pet python,Reptile,https://www.petassure.com/maxscorner/pet-python-safety-concerns/,United States,National (US),0.9158,"Q5_Safety_Risk, Q6_Animal_Welfare"
Google Search,"pet python snake care sheet pythons are solitary animals that should always be housed alone. keeping more than one python in the same habitat can encourage stress, ...",2026-02-27,pet python,Reptile,https://www.petmd.com/reptile/pet-python-snake-care-sheet,United States,National (US),0.4019,Q6_Animal_Welfare
Google Search,"someone tell me everything about owning a snake for ... overall captive bred babies are what you want if you want a handleable snake, raised in captivity they are much more likely to take to handling, ...",2026-02-27,pet python,Reptile,https://www.reddit.com/r/snakes/comments/14em8xa/someone_tell_me_everything_about_owning_a_snake/,United States,National (US),0.1531,"Q1_Sentiment, Q6_Animal_Welfare"
Google Search,"owning a pet snake ideally, only captive-bred animals should be sold as pets. wild-caught snakes are less tolerant of stress, more likely to refuse food, and often harbor higher ...",2026-02-27,pet python,Reptile,https://vcahospitals.com/know-your-pet/snakes-owning,United States,National (US),-0.101,
Google Search,"new snake owner - ball pythons i think ball pythons are a wonderful beginner pet, as they are typically a very docile and laid-back species. they are also relatively easy ...",2026-02-27,pet python,Reptile,https://community.morphmarket.com/t/new-snake-owner/3599,United States,National (US),0.765,
Google Search,pythons: are they ever a good idea for a pet? pythons are the most widely owned snake in north america – and they would not usually consider a human being as food.,2026-02-27,pet python,Reptile,https://www.theglobeandmail.com/life/relationships/exotic-pets-are-they-ever-a-good-idea/article13759785/,United States,National (US),0.4404,
Google Search,"why a ball python might be the perfect pet for you typically, these snakes grow to an average length of 3 to 5 feet, making them manageable for most pet owners. their gentle disposition and ...",2026-02-27,pet python,Reptile,https://www.wilbanksreptiles.com/blogs/ball-python/why-a-ball-python-might-be-the-perfect-pet-for-you?srsltid=AfmBOoqRPoAklCcMz5CMTA4bsu9IG4591woDJviMwI_I1SLnGkMT4Fwv,United States,National (US),0.765,
Google Search,"responsible snake ownership – florida snake id guide all captive snakes must be kept in an enclosure when not being safely handled. after purchasing a snake suitable to their level of expertise, ...",2026-02-27,pet python,Reptile,https://www.floridamuseum.ufl.edu/florida-snake-id/responsible-snake-ownership/,United States,National (US),-0.0844,
Google Search,"how good is a python as a pet? do they respect and trust ... a snake can get to know and trust its owner — not just humans in general, but that specific person. it can be comfortable with its owner, and ...",2026-02-27,pet python,Reptile,https://www.quora.com/How-good-is-a-python-as-a-pet-Do-they-respect-and-trust-the-owner-Can-they-share-their-feelings-with-humans,United States,National (US),0.8945,
Google Search,"pros and cons of owning a boa constrictor - happilygus a boa is a serious commitment. all pets, dogs and cats included, require some sort of specialty care to give them a quality life. however, if ...",2026-02-27,pet boa,Reptile,https://happilygus.com/is-a-boa-constrictor-the-best-pet-for-you/,United States,National (US),0.6378,Q6_Animal_Welfare
Google Search,"boa constrictor: species profile - pet snakes captive-bred boas are generally healthier and more docile than their wild-caught counterparts. the prices can widely vary, depending on the type ...",2026-02-27,pet boa,Reptile,https://www.thesprucepets.com/boa-constrictors-as-pets-1237315,United States,National (US),0.0,
Google Search,"i just spent nearly $700 on my boa's adult enclosure. ... i just spent nearly $700 on my boa's adult enclosure. owning a pet is not cheap, so be aware of this before you adopt that $70 colombian boa from the pet store.",2026-02-27,pet boa,Reptile,https://www.reddit.com/r/boas/comments/paqoxs/i_just_spent_nearly_700_on_my_boas_adult/,United States,National (US),0.1779,
Google Search,"red-tailed boa pet risk and care assessment this assessment explains the high risks of keeping a red-tailed boa, including conservation concerns, health risks, and long-term care ...",2026-02-27,pet boa,Reptile,https://www.worldwildlife.org/our-work/wildlife/wildlife-crime/responsible-pet-guide/assessed-exotic-species/red-tailed-boa/,United States,National (US),0.2732,Q6_Animal_Welfare
Google Search,"pet boa constrictor care sheet boas are solitary animals that should be housed alone. keeping more than one boa in the same habitat can encourage stress, aggression, and competition.",2026-02-27,pet boa,Reptile,https://www.petmd.com/reptile/boa-constrictor-care-sheet,United States,National (US),0.128,Q6_Animal_Welfare
Google Search,benefits of boa constrictors as pets captive boa constrictors have a life span of 20-25 years which is average in the world of reptiles. the beauty of owning a pet that can live a ...,2026-02-27,pet boa,Reptile,https://www.xyzreptiles.com/benefits-of-boa-constrictors-as-pets/,United States,National (US),0.7506,
Google Search,"looking to buy a boa constrictor? read this the best way to get a boa constrictor is to buy it from a professional breeder — as in, someone who has been doing this for years and puts their animals' health ...",2026-02-27,pet boa,Reptile,https://reptifiles.com/boa-constrictor-care/buy-boa-constrictor-guide/,United States,National (US),0.6369,
Google Search,expert tips for boa constrictor pet care considering owing a boa constrictor? · lifestyle: the lifespan of a boa constrictors can range from 20 to 30 years. · legality: local regulations ...,2026-02-27,pet boa,Reptile,https://www.wilbanksreptiles.com/blogs/taking-care-of-boa-constrictor/expert-tips-for-boa-constrictor-pet-care?srsltid=AfmBOorxgF17XcbVvFxID17CSsLY_RVdQc7hj2Z9mB2ojfQeFM7pSK68,United States,National (US),0.4939,Q6_Animal_Welfare
Google Search,beginner snake owner - boa constrictors in my opinion boas are the best pet snake out there. i have owned boas for over 49 years. just make sure you buy a baby boa or a 1 year old ...,2026-02-27,pet boa,Reptile,https://community.morphmarket.com/t/beginner-snake-owner/56164,United States,National (US),0.7579,
Google Search,"reptile ownership laws by state $50 for a member of the family elapidae, viperidae, crotalidae, atractaspidae, or hydrophidae which are venomous, including but not limited to cobras, mambas, ...",2026-02-27,pet cobra,Reptile,https://usark.org/reptile-ownership-laws-by-state/,United States,National (US),0.2498,"Q4_Legal_Risk, Q5_Safety_Risk"
Google Search,can anyone tell me how is legal to sell/buy cobra? i seen ... cobra is not a protected animal in thailand so you can buy it as a pet from exotic pet shop.|it is not illegal to own a pet cobra in thailand.,2026-02-27,pet cobra,Reptile,https://www.facebook.com/groups/VenomousAndOtherSnakesOfSiam/posts/2639364339568533/,United States,National (US),0.2542,"Q1_Sentiment, Q4_Legal_Risk"
Google Search,"pet cobras: what it takes to own a venomous reptile in florida owners must complete at least 1,000 hours of experience with venomous reptiles and provide two reference letters from license holders. they also ...",2026-02-27,pet cobra,Reptile,https://www.wsoctv.com/news/trending-now/pet-cobras-what-it-takes-to-own-a-venomous-reptile-in-florida/502920715/,United States,National (US),0.0,"Q4_Legal_Risk, Q5_Safety_Risk"
Google Search,"what is it like to have a cobra as a pet? much like keeping any snake. they need a warm place, room to slither, fresh water and a rodent or such when its dinner.",2026-02-27,pet cobra,Reptile,https://www.quora.com/What-is-it-like-to-have-a-cobra-as-a-pet,United States,National (US),0.802,
Google Search,"cobras make bad pets...duh! | worms & germs blog there's absolutely no reason for these creatures to be kept as pets, and no reason that keeping and selling them shouldn't be met by large fines ...",2026-02-27,pet cobra,Reptile,https://www.wormsandgermsblog.com/2011/02/articles/animals/other-animals/cobras-make-bad-pets-duh/,United States,National (US),-0.8169,
Google Search,"someone tell me everything about owning a snake for ... overall captive bred babies are what you want if you want a handleable snake, raised in captivity they are much more likely to take to handling, ...",2026-02-27,pet cobra,Reptile,https://www.reddit.com/r/snakes/comments/14em8xa/someone_tell_me_everything_about_owning_a_snake/,United States,National (US),0.1531,"Q1_Sentiment, Q6_Animal_Welfare"
Google Search,"is it legal to keep a king cobra as a pet? – north carolina ... penalties. violation of the venomous reptile, large constricting snake, or crocodilian laws is a class 2 misdemeanor. g.s. 14-422. if anyone ...",2026-02-27,pet cobra,Reptile,https://nccriminallaw.sog.unc.edu/2016/05/11/legal-keep-king-cobra-pet/,United States,National (US),-0.4019,"Q4_Legal_Risk, Q5_Safety_Risk"
Google Search,"king cobra, the best pet snake? the most dangerous ... https://thefrogknightg... the king cobra (ophiophagus hannah) is one of the most dangerous snakes in the world. they are long, fast, and highly ...",2026-02-27,pet cobra,Reptile,https://www.youtube.com/watch?v=MQ_P9sDKa7I,United States,National (US),-0.379,"Q1_Sentiment, Q5_Safety_Risk"
Google Search,"is it legal to own a king cobra in the usa? | expert q&a ownership often requires permits, secure enclosures, and adherence to safety protocols. illegal possession can lead to fines or confiscation.",2026-02-27,pet cobra,Reptile,https://www.justanswer.com/pet/03gur-king-cobra-s-legal-usa.html,United States,National (US),0.2732,"Q1_Sentiment, Q4_Legal_Risk"
Google Search,illegal animals | washington state department of agriculture some of the animals illegal to own under this law are: lions; tigers; cougars; wolves; bears; monkeys (non human primates); marmosets; lemurs; cobras ...,2026-02-27,pet cobra,Reptile,https://agr.wa.gov/departments/animals-livestock-and-pets/animal-health/import-requirements/illegal-animals,United States,National (US),-0.802,"Q1_Sentiment, Q4_Legal_Risk"
Google Search,"iguanas - owning most owners buy iguanas locally from a reptile fair, breeder, or pet store. online purchases have become more common over the past few years. young, captive- ...",2026-02-27,pet iguana,Reptile,https://vcahospitals.com/know-your-pet/iguanas---owning,United States,National (US),0.3182,
Google Search,"a guide to caring for iguanas as pets pet iguanas will never be truly domesticated animals, and many of them will try to escape their enclosures and even your home. captive iguanas ...",2026-02-27,pet iguana,Reptile,https://www.thesprucepets.com/iguanas-as-pets-1236880,United States,National (US),0.3599,
Google Search,"wwf responsible pet guide: iguana care essentials exotic pet ownership, however, is regulated at the state, county, or city level, so check your jurisdiction to see if you can own it.",2026-02-27,pet iguana,Reptile,https://www.worldwildlife.org/our-work/wildlife/wildlife-crime/responsible-pet-guide/assessed-exotic-species/iguana/,United States,National (US),0.6705,Q6_Animal_Welfare
Google Search,iguana as a pet: what you should know | rabun county vet iguanas kept as pets must be picked up and held frequently in order for them to develop a sense of trust and comfort. they frequently find human ...,2026-02-27,pet iguana,Reptile,https://www.rabunanimalhospital.com/site/blog/2023/08/07/iguana-pet,United States,National (US),0.7003,
Google Search,"iguana as a pet: everything you should know | turlock vets iguanas can be tamed with adequate daily care, but they have a strong self-defense drive and will bite, scratch, and whip their tails if challenged.",2026-02-27,pet iguana,Reptile,https://www.turlockvet.com/site/blog/2023/03/15/iguana-pet,United States,National (US),0.7506,"Q5_Safety_Risk, Q6_Animal_Welfare"
Google Search,"i really want a pet iguana, however, i have never owned ... iguanas, nor any reptile, are a good first pet. neither are birds. their needs far exceed those of say a cat, dog, rabbit, or guinea pig. they ...",2026-02-27,pet iguana,Reptile,https://www.reddit.com/r/iguanas/comments/153ujpv/i_really_want_a_pet_iguana_however_i_have_never/,United States,National (US),0.5413,Q1_Sentiment
Google Search,"iguana as a pet: what you should know | clarksville vet iguanas are a popular choice for pet reptiles, but they demand a lot of time, care, and space. they need special attention for feeding and housing.",2026-02-27,pet iguana,Reptile,https://www.sangoveterinaryhospital.net/site/blog/2023/10/15/iguana-pet,United States,National (US),0.8402,Q6_Animal_Welfare
Google Search,"iguana as a pet: what you should know | jackson vet a single iguana requires an enclosure that measures around 12 feet in length, 6 feet wide, and 8 feet tall. many iguana owners prefer custom ...",2026-02-27,pet iguana,Reptile,https://www.northmadisonanimalvet.com/site/blog/2023/06/21/iguana-pet,United States,National (US),0.0,
Google Search,are monitors good pets? : r/monitorlizards are monitor lizards good pets? best monitor lizard species for beginners.,2026-02-27,pet monitor lizard,Reptile,https://www.reddit.com/r/MonitorLizards/comments/qkw7re/are_monitors_good_pets/,United States,National (US),0.885,
Google Search,how to care for a pet savannah monitor savannah monitors can make good pets for experienced lizard owners. ... pet lizards · axolotls in a tank. tank options for ...,2026-02-27,pet monitor lizard,Reptile,https://www.thesprucepets.com/savannah-monitors-1239214,United States,National (US),0.7269,Q6_Animal_Welfare
Google Search,"reptile ownership laws by state varanidae (monitor lizard); xantusiidae (night lizards); xenosauridae (knob ... all species of wall lizards, except those listed in appendix that require an ...",2026-02-27,pet monitor lizard,Reptile,https://usark.org/reptile-ownership-laws-by-state/,United States,National (US),0.0,Q4_Legal_Risk
Google Search,"monitor lizard as a pet: is it a good idea? in the u.s, it is legal to keep a monitor lizard as a pet, but that doesn't mean it is the best idea. monitor lizards are not a pet for beginner ...",2026-02-27,pet monitor lizard,Reptile,https://a-z-animals.com/blog/monitor-lizard-as-a-pet-is-it-a-good-idea/,United States,National (US),0.8402,
Google Search,getting approved for exotic pet license for monitor lizard? getting approved for exotic pet license for monitor lizard? monitor ... the owner came in the next day and told petco their savannah monitor ...,2026-02-27,pet monitor lizard,Reptile,https://www.facebook.com/groups/1174895846415748/posts/2034254357146555/,United States,National (US),0.7149,Q4_Legal_Risk
Google Search,"a guide to responsible monitor lizard ownership owning a monitor lizard is not for everyone. it requires significant financial resources, a lot of space, a strong stomach for feeding whole prey, and a deep ...",2026-02-27,pet monitor lizard,Reptile,https://88petsworld.net/the-mighty-monitor-a-guide-to-responsible-monitor-lizard-ownership/,United States,National (US),0.7506,
Google Search,"tips to care for pet monitor lizards if your lizard appears agitated or defensive, give them space to avoid bites or scratches. ✓ do's and don'ts. when caring for monitor lizards, ...",2026-02-27,pet monitor lizard,Reptile,https://www.dialavet.com/blog/tips-to-care-for-pet-monitor-lizards,United States,National (US),-0.5466,"Q5_Safety_Risk, Q6_Animal_Welfare"
Google Search,nile monitor nile monitors can live up to 20 years in captivity. they are the largest lizard species in africa and can attain lengths of about 6.5 feet and weigh up to 17.8 ...,2026-02-27,pet monitor lizard,Reptile,https://myfwc.com/wildlifehabitats/profiles/reptiles/lizards/nile-monitor/,United States,National (US),0.0,Q6_Animal_Welfare
Google Search,"why are monitor lizards so affectionate as pets, despite ... do monitor lizards get along with dogs? what dangers does the lizard pose to my dog? 17,772 views.",2026-02-27,pet monitor lizard,Reptile,https://www.quora.com/Why-are-monitor-lizards-so-affectionate-as-pets-despite-being-solitary-reptiles,United States,National (US),0.2266,Q5_Safety_Risk
Google Search,do's and don'ts of parrot ownership do concentrate on good behavior. do give your birds a bath with water only or mist with a spray bottle at least 2 to 3 times a week.,2026-02-27,pet parrot,Bird,https://centerforanimalrehab.org/dos-and-donts-of-parrot-ownership/,United States,National (US),0.4404,
Google Search,"thinking of buying a parrot? parrots of all types are attractive and rewarding birds to keep, but the requirements for their management and the demands made on their owners can be very ...",2026-02-27,pet parrot,Bird,https://theparrotsocietyuk.org/site/index.php/parrot-information/new-to-pet-parrots/thinking-of-buying-a-parrot/,United States,National (US),0.4854,
Google Search,"what are the pros and cons of owning a parrot compared to ... parrots are loud, messy, can get expensive, require a lot of attention and training, and take a lot of time to learn their body language and ...",2026-02-27,pet parrot,Bird,https://www.reddit.com/r/parrots/comments/1fxwwen/what_are_the_pros_and_cons_of_owning_a_parrot/,United States,National (US),-0.3612,
Google Search,"parrot ownership: pros, cons and what to expect before ... pet parrots need daily interaction and training. parrots need lots of interaction with other living things so time outside the cage is essential ...",2026-02-27,pet parrot,Bird,https://www.latimes.com/companion-animals/small-animals/care/story/pet-parrot-care-guide,United States,National (US),0.0,
Google Search,"ten reasons you shouldn't get a parrot as a first-time parrot owner, you should never purchase or adopt a previously owned parrot. there is a reason why the owner is selling or abandoning the parrot, ...",2026-02-27,pet parrot,Bird,https://viemagazine.com/article/ten-reasons-you-shouldnt-get-a-parrot/,United States,National (US),-0.4798,
Google Search,"the reality of parrot ownership! because owning a parrot is like being in a long-term relationship - it's a big responsibility, and you need to be prepared for the long haul.",2026-02-27,pet parrot,Bird,https://www.facebook.com/groups/1024490957622648/posts/2518617914876604/,United States,National (US),0.5707,
Google Search,"what parrot is right for the first time owner? i don't believe that there is any species of parrot that should be considered a “beginner bird”. smaller birds are just as in need of enrichment, good food and ...",2026-02-27,pet parrot,Bird,https://birdtricksstore.com/blogs/birdtricks-blog/what-parrot-is-right-for-the-first-time-owner?srsltid=AfmBOorvtHDprrpNyNf0EAAkal4xXhmdfdufV5gLJlkTfThCBF0xK4KZ,United States,National (US),0.4404,
Google Search,"selecting a pet bird | american veterinary medical ... your choice of bird will be affected by your preferences for appearance, personality, companionship or ability to talk.",2026-02-27,pet parrot,Bird,https://www.avma.org/resources/pet-owners/petcare/selecting-pet-bird,United States,National (US),0.1779,
Google Search,"macaws as pets: what it's really like to own one discover what it takes to care for macaws as pets, from their history and behaviour to expert care tips for a happy, healthy, ...",2026-02-27,pet macaw,Bird,https://parrotessentials.co.uk/blog/macaws-as-pets-what-its-really-like-to-own-one,United States,National (US),0.9392,Q6_Animal_Welfare
Google Search,"getting a macaw as a first-time bird owner if they live for 50+ years, there's not much time to “waste” building up experience with other birds.",2026-02-27,pet macaw,Bird,https://www.reddit.com/r/Macaws/comments/x6g2r4/getting_a_macaw_as_a_firsttime_bird_owner/,United States,National (US),0.0,
Google Search,"everything you need to know about pet macaws macaws are the largest of the parrot family. these colorful, loud birds need lots of space and time with their owner. learn more about this parrot in our guide ...",2026-02-27,pet macaw,Bird,https://www.kaytee.com/learn-care/pet-birds/everything-you-need-to-know-about-pet-macaws,United States,National (US),0.0,
Google Search,"pet macaws: the good, the bad and the wildly funny macaw owners need to set clear limits on a macaw's behavior and to consistently uphold those rules and expectations. do not allow the beak ...",2026-02-27,pet macaw,Bird,https://www.chewy.com/education/bird/general/pet-macaws-the-good-the-bad-and-the-wildly-funny,United States,National (US),0.4997,
Google Search,"5 pros & cons of owning a pet macaw - cb bird blog keeping macaws as pets is not cheap. large cages, premium food, toys, and veterinary care all add to the total expense of ownership.",2026-02-27,pet macaw,Bird,https://shopcheekybeaks.com/blogs/bird-parenting-tips/pros-cons-pet-macaws?srsltid=AfmBOooj9Y9-cd0jf1IV-COGNSCh7fEU2e3HFHq_DUn0jnhnVKtuCBnk,United States,National (US),0.4939,Q6_Animal_Welfare
Google Search,considering a macaw as a pet? they dont need 24/7 supervision and can play well on own. they love to chew wood and destroy stuff so a huge cage with lots of toys and they can ...,2026-02-27,pet macaw,Bird,https://www.facebook.com/groups/allpetfairs/posts/2239499376341037/,United States,National (US),0.7769,Q1_Sentiment
Google Search,"what is it like to have a pet macaw? a macaw is an extremely intelligent exotic bird and will likely outlive you. they are not toys to show off your status. vet bills, a good cage, ...",2026-02-27,pet macaw,Bird,https://www.quora.com/What-is-it-like-to-have-a-pet-macaw,United States,National (US),0.8268,
Google Search,"macaws as a macaw owner, you'll want to schedule regular veterinary exams and watch your pet closely for health problems. don't be alarmed if your macaw sneezes ...",2026-02-27,pet macaw,Bird,https://uptownvethospital.org/articles/627326-macaws,United States,National (US),-0.0936,Q1_Sentiment
