platform,text_content,date,keyword_used,category,source_url,country_context,location_geographic,sentiment_score,top_20_mapping
Google Search,"macaw personality, food & care – pet birds ... macaws are big birds; big in size and in personality. several species from various genera are kept as pets. do you have what it takes to own a macaw?",2026-02-27,pet macaw,Bird,https://lafeber.com/pet-birds/species/macaw/?srsltid=AfmBOoofXPgeq6zsX_YfjwzErYyHa075ap7DevMLhfhqnP18BJsbxyyP,United States,National (US),0.4939,Q6_Animal_Welfare
Google Search,"cockatoo owner perfectly describes the experience of ... the downside is their maintenance. they are loud, destructive, and (very) messy. but honestly, if you have time to spend with them they truly ...",2026-02-27,pet cockatoo,Bird,https://www.reddit.com/r/bestof/comments/42y64h/cockatoo_owner_perfectly_describes_the_experience/,United States,National (US),0.7875,
Google Search,"what pet bird owners should know about cockatoos cockatoos are affectionate, intelligent, and entertaining companions, but they require a dedicated, experienced owner who can meet their social, mental, and ...",2026-02-27,pet cockatoo,Bird,https://myrightbird.com/articles/what-pet-bird-owners-should-know-about-cockatoos,United States,National (US),0.836,
Google Search,"wwf guide: cockatoo ownership considerations wwf highlights why cockatoos require specialized, lifelong care and stresses responsible sourcing and informed exotic pet ownership.",2026-02-27,pet cockatoo,Bird,https://www.worldwildlife.org/our-work/wildlife/wildlife-crime/responsible-pet-guide/assessed-exotic-species/sulfur-crested-cockatoo/,United States,National (US),0.3612,Q6_Animal_Welfare
Google Search,6 tips for cockatoo owners here are 6 tips for cockatoo owners: · 1. no petting under the wings · 2. no cuddling underneath covers or blankets or dark places · 3. height… · 4. plenty of bird ...,2026-02-27,pet cockatoo,Bird,https://www.funtimebirdy.com/6-tips-for-cockatoo-owners/?srsltid=AfmBOoo7t0MneM3aTyht5WFqIeXeB0W8i0aNqD0nhSKeuf0Z2TL3B81L,United States,National (US),-0.5267,
Google Search,"everything you need to know about pet cockatoos to build a connection with your pet cockatoo, offer plenty of love, patience, consistency in routine, and a stress-free environment. the veterinarians explain ...",2026-02-27,pet cockatoo,Bird,https://www.kaytee.com/learn-care/pet-birds/everything-you-need-to-know-about-pet-cockatoos,United States,National (US),0.6369,Q1_Sentiment
Google Search,"what are the pros and cons of owning a white cockatoo as ... cockatoos are up there with dog ownership as far as tending to, interacting with, and cleaning up after. if you work full time or have a lot of ...",2026-02-27,pet cockatoo,Bird,https://www.quora.com/What-are-the-pros-and-cons-of-owning-a-white-cockatoo-as-a-pet,United States,National (US),0.0,
Google Search,"owning a pet cockatoo: pros and cons? all that aside he's a wonderful companion and gives spark in my life, he's so cuddly and sweet and knows what he's doing he's very self aware ...",2026-02-27,pet cockatoo,Bird,https://www.facebook.com/groups/1024490957622648/posts/3514114891993563/,United States,National (US),0.8344,
Google Search,"the truth about owning a cockatoo, please - parrot forum they are not always loving like pet shop say they are. the beak of a cockatoo has three points that can do a lot of damage to a human. some talk ...",2026-02-27,pet cockatoo,Bird,https://www.parrotforums.com/threads/the-truth-about-owning-a-cockatoo-please.14304/,United States,National (US),-0.5935,
